<?xml version="1.0" encoding="UTF-8"?>
<report xsi:schemaLocation="https://www.mojohaus.org/TAGLISTOUTPUT/1.0.0 https://www.mojohaus.org/taglist-maven-plugin/xsd/taglistOutput-1.0.0.xsd"
        xmlns="https://www.mojohaus.org/TAGLISTOUTPUT/1.0.0"
        xmlns:xsi="http://www.w3.org/2001/XMLSchema-instance">
  <tags>
    <tag name="@create_output" count="1">
      <files>
        <file name="com.BasicConfig" count="1">
          <comments>
            <comment>
              <lineNumber>11</lineNumber>
              <comment>This is the tag for the output test.</comment>
            </comment>
          </comments>
        </file>
      </files>
    </tag>
  </tags>
</report>
